{
  "meta": {
    "source": "HistoryCast podcast (rss.com/rs-historycast)",
    "generated": "2026-07-26T09:00:00Z",
    "count": 20,
    "schemaVersion": "1.0",
    "note": "PROTOTYPE sample — 2 episodes, hand-curated & geocoded for Phase 1. Full dataset (all 181 episodes) comes in Phase 3."
  },

  "places": [
    { "id": "skoplje", "name": { "sr": "Skoplje", "en": "Skopje" }, "aliases": ["Skoplju", "Skoplja"], "lat": 41.9981, "lng": 21.4254, "kind": "city" },
    { "id": "carigrad", "name": { "sr": "Carigrad", "en": "Constantinople" }, "aliases": ["Carigradu", "Carigrada", "Vizantija", "Vizantije"], "lat": 41.0082, "lng": 28.9784, "kind": "city" },
    { "id": "solun", "name": { "sr": "Solun", "en": "Thessaloniki" }, "aliases": ["Soluna", "Solunu"], "lat": 40.6401, "lng": 22.9444, "kind": "city" },
    { "id": "galipolje", "name": { "sr": "Galipolje", "en": "Gallipoli" }, "aliases": ["Galipolja"], "lat": 40.4083, "lng": 26.6708, "kind": "city" },
    { "id": "kosovo-polje", "name": { "sr": "Kosovo polje", "en": "Kosovo Field" }, "aliases": ["Kosovu", "Kosova"], "lat": 42.6667, "lng": 21.1000, "kind": "battle-site" },
    { "id": "reka-marica", "name": { "sr": "reka Marica (Černomen)", "en": "Maritsa River (Chernomen)" }, "aliases": ["Marica", "Marici"], "lat": 41.7500, "lng": 26.3000, "kind": "battle-site" },
    { "id": "saurско-polje", "name": { "sr": "Saursko polje", "en": "Battle of Savra (Saurian field)" }, "aliases": ["Savra"], "lat": 41.0000, "lng": 19.7000, "kind": "battle-site" },

    { "id": "lindisfarne", "name": { "sr": "Lindisfarn", "en": "Lindisfarne" }, "aliases": ["Lindisfar", "Lindisfarne"], "lat": 55.6811, "lng": -1.8017, "kind": "landmark" },
    { "id": "carigrad-rus", "name": { "sr": "Carigrad (napad Rusa)", "en": "Constantinople (Rus' attack)" }, "aliases": ["Carigrad", "Carigrada"], "lat": 41.0082, "lng": 28.9784, "kind": "city" },
    { "id": "jork", "name": { "sr": "Jork (Nortambrija)", "en": "York (Northumbria)" }, "aliases": ["Nortambrije", "Nortambrija", "Jorvik"], "lat": 53.9599, "lng": -1.0873, "kind": "city" },
    { "id": "normandija", "name": { "sr": "Normandija", "en": "Normandy" }, "aliases": ["Normani", "Normandije"], "lat": 49.1829, "lng": -0.3707, "kind": "region" },
    { "id": "island", "name": { "sr": "Island", "en": "Iceland" }, "aliases": ["Islandu", "Islanda", "Islandi"], "lat": 64.9631, "lng": -19.0208, "kind": "region" },
    { "id": "grenland", "name": { "sr": "Grenland", "en": "Greenland" }, "aliases": ["Grenlandu", "Grenlanda"], "lat": 64.1836, "lng": -51.7214, "kind": "region" },
    { "id": "vinland", "name": { "sr": "Vinland (Severna Amerika)", "en": "Vinland (North America)" }, "aliases": ["Amerika", "Americi", "Amerike"], "lat": 51.5964, "lng": -55.5316, "kind": "landmark" },
    { "id": "hejstings", "name": { "sr": "Hejstings", "en": "Hastings" }, "aliases": ["Hastings"], "lat": 50.9110, "lng": 0.4865, "kind": "battle-site" },
    { "id": "pariz", "name": { "sr": "Pariz", "en": "Paris" }, "aliases": ["Pariza", "Parizu"], "lat": 48.8566, "lng": 2.3522, "kind": "city" }
  ],

  "episodes": [
    {
      "id": "09",
      "title": { "sr": "Dušanova Srbija: Uspon carstva", "en": "Dušan's Serbia: Rise of the Empire" },
      "pubDate": "2023-10-22",
      "audioUrl": "https://content.rss.com/episodes/186457/1184339/rs-historycast/2023_10_22_19_22_55_792cd8d7-8db8-4be7-b9d9-a97da5e27f0c.mp3",
      "color": "#c0392b"
    },
    {
      "id": "95",
      "title": { "sr": "Kosovska bitka (HistoryCast specijal)", "en": "The Battle of Kosovo (HistoryCast special)" },
      "pubDate": "2025-06-25",
      "audioUrl": "https://content.rss.com/episodes/186457/2060962/rs-historycast/2025_06_25_22_52_48_300c47eb-0.mp3",
      "color": "#2c3e50"
    },
    {
      "id": "140",
      "title": { "sr": "Vikinzi", "en": "The Vikings" },
      "pubDate": "2026-04-23",
      "audioUrl": "https://content.rss.com/episodes/186457/2762785/rs-historycast/2026_04_23_22_32_47_76d92797-f338-4a67-8a62-05cbf47abe66.mp3",
      "color": "#1e8449"
    }
  ],

  "events": [
    {
      "id": "cetvrti-krstaski-rat-1204",
      "title": { "sr": "Pad Carigrada u Četvrtom krstaškom ratu", "en": "Sack of Constantinople (Fourth Crusade)" },
      "year": 1204, "yearEnd": null,
      "placeId": "carigrad", "episodeId": "09", "timestamp": "27:03",
      "type": "siege", "actors": ["Vizantija", "krstaši"], "region": "Vizantija",
      "description": { "sr": "Vizantija je od 1204. oslabljena, što otvara prostor za uspon srpske države.", "en": "From 1204 Byzantium is weakened, opening space for the rise of the Serbian state." },
      "quote": "ono od 1204. godine ima neke onako epizode koje ugrožavaju Vizantiju",
      "confidence": "high"
    },
    {
      "id": "dusan-krunisanje-1346",
      "title": { "sr": "Krunisanje Stefana Dušana za cara", "en": "Coronation of Stefan Dušan as Emperor" },
      "year": 1346, "yearEnd": null,
      "placeId": "skoplje", "episodeId": "09", "timestamp": "67:07",
      "type": "coronation", "actors": ["Stefan Dušan", "Pećka patrijaršija"], "region": "Srpsko carstvo",
      "description": { "sr": "Na Uskrs 1346. u Skoplju svečano obavljeno ustoličenje cara Srba i Grka.", "en": "At Easter 1346 in Skopje, Dušan is solemnly enthroned as Emperor of the Serbs and Greeks." },
      "quote": "krunisanje pada tek naredne 1346. godine na uskrs, kada je u Skoplju svečano obavljeno čin ustoličenja cara",
      "confidence": "high"
    },
    {
      "id": "dusan-solun-ambicija",
      "title": { "sr": "Dušanova težnja ka Solunu", "en": "Dušan's ambition toward Thessaloniki" },
      "year": 1350, "yearEnd": 1355,
      "placeId": "solun", "episodeId": "09", "timestamp": "66:38",
      "type": "conquest", "actors": ["Stefan Dušan"], "region": "Srpsko carstvo",
      "description": { "sr": "Dušan nije uspeo da ostvari san o osvajanju Soluna do svoje smrti.", "en": "Dušan never fulfilled his dream of taking Thessaloniki before his death." },
      "quote": "dušan umire 1355. godine, ne ostvarivši svoj san da osvoji Solun",
      "confidence": "medium"
    },
    {
      "id": "dusan-smrt-1355",
      "title": { "sr": "Smrt cara Dušana", "en": "Death of Emperor Dušan" },
      "year": 1355, "yearEnd": null,
      "placeId": "skoplje", "episodeId": "09", "timestamp": "66:38",
      "type": "death", "actors": ["Stefan Dušan"], "region": "Srpsko carstvo",
      "description": { "sr": "Car Dušan umire 1355. godine; počinje raspad carstva.", "en": "Emperor Dušan dies in 1355; the empire begins to fragment." },
      "quote": "dušan umire 1355. godine",
      "confidence": "high"
    },
    {
      "id": "turci-galipolje-1354",
      "title": { "sr": "Turci prelaze u Evropu — osvajanje Galipolja", "en": "Ottomans cross into Europe — capture of Gallipoli" },
      "year": 1354, "yearEnd": null,
      "placeId": "galipolje", "episodeId": "95", "timestamp": "08:01",
      "type": "conquest", "actors": ["Osmansko carstvo"], "region": "Osmansko carstvo",
      "description": { "sr": "Turci prelaze na teritoriju Evrope 1354. i osvajaju Galipolje — uporište na Balkanu.", "en": "In 1354 the Ottomans cross into Europe and take Gallipoli, their bridgehead in the Balkans." },
      "quote": "Turci prelaze na teritoriju Evrope 1354. godine, kada osvajaju Galipolje",
      "confidence": "high"
    },
    {
      "id": "marica-1371",
      "title": { "sr": "Maричка bitka (Černomen)", "en": "Battle of Maritsa (Chernomen)" },
      "year": 1371, "yearEnd": null,
      "placeId": "reka-marica", "episodeId": "09", "timestamp": "110:04",
      "type": "battle", "actors": ["Srbija", "Osmansko carstvo"], "region": "Balkan",
      "description": { "sr": "26. septembra 1371. srpska vojska teško poražena na Marici — put ka Kosovu.", "en": "On 26 September 1371 the Serbian army is crushed on the Maritsa — the road toward Kosovo." },
      "quote": "26. septembra 1371. godine",
      "confidence": "high"
    },
    {
      "id": "savra-1385",
      "title": { "sr": "Bitka na Saurском polju", "en": "Battle of Savra" },
      "year": 1385, "yearEnd": null,
      "placeId": "saurско-polje", "episodeId": "95", "timestamp": "62:17",
      "type": "battle", "actors": ["Balša II", "Osmansko carstvo"], "region": "Balkan",
      "description": { "sr": "1385. godine sukob sa Turcima; osmanski pritisak na Balkan raste.", "en": "In 1385, clash with the Ottomans; pressure on the Balkans intensifies." },
      "quote": "1385. godine, u bašu boju sa Turcima",
      "confidence": "medium"
    },
    {
      "id": "bitka-plocnik-1386",
      "title": { "sr": "Događaji oko 1386. (Pločnik)", "en": "Events around 1386 (Pločnik)" },
      "year": 1386, "yearEnd": null,
      "placeId": "kosovo-polje", "episodeId": "95", "timestamp": "51:14",
      "type": "battle", "actors": ["Lazar", "Osmansko carstvo"], "region": "Srbija",
      "description": { "sr": "1386. — narastajući sukobi uoči Kosovske bitke.", "en": "1386 — escalating conflicts on the eve of the Battle of Kosovo." },
      "quote": "1386. godine",
      "confidence": "low"
    },
    {
      "id": "kosovska-bitka-1389",
      "title": { "sr": "Kosovska bitka", "en": "The Battle of Kosovo" },
      "year": 1389, "yearEnd": null,
      "placeId": "kosovo-polje", "episodeId": "95", "timestamp": "65:58",
      "type": "battle", "actors": ["knez Lazar", "sultan Murat", "Miloš Obilić"], "region": "Srbija",
      "description": { "sr": "15. juna 1389. odigrala se Kosovska bitka između srpske vojske kneza Lazara i Osmanlija sultana Murata.", "en": "On 15 June 1389 the Battle of Kosovo is fought between Prince Lazar's Serbs and Sultan Murad's Ottomans." },
      "quote": "15. juna 1389. godine",
      "confidence": "high"
    },
    {
      "id": "osmansko-osvajanje-nastavak",
      "title": { "sr": "Nastavak osmanskih osvajanja", "en": "Continued Ottoman conquests" },
      "year": 1395, "yearEnd": null,